"Name","Survey Title","Department","Tenure","Submission Date","Submission Time","Question 1","Answer 1","Question 2","Answer 2","Question 3","Answer 3","Question 4","Answer 4","Question 5","Answer 5","Question 6","Answer 6","Question 7","Answer 7","Question 8","Answer 8","Question 9","Answer 9","Question 10","Answer 10","Question 11","Answer 11","Question 12","Answer 12","Question 13","Answer 13","Question 14","Answer 14","Question 15","Answer 15","Question 16","Answer 16","Question 17","Answer 17","Question 18","Answer 18","Question 19","Answer 19","Question 20","Answer 20","Question 21","Answer 21","Question 22","Answer 22","Question 23","Answer 23","Question 24","Answer 24","Question 25","Answer 25","Question 26","Answer 26","Question 27","Answer 27","Question 28","Answer 28","Question 29","Answer 29","Question 30","Answer 30","Question 31","Answer 31","Question 32","Answer 32","Question 33","Answer 33"
"Dikshant Buwa","How would you rate KISNA on the following 1-5 Scale: (5-Very Good, 4-Good, 3-Average, 2- Poor, 1- Very Poor )","Finance","0-6 months","6/27/2025","10:02:27 AM","Please rate your experience with the onboarding and induction process.","3","Training programs have supported my skill enhancement.","3","I clearly understand my job responsibilities; feel my skills are being utilized and satisfied with my current role.","1","I always feel included in team discussions, decisions, work process & policy implementation and activities.","3","My career path and growth opportunity are clear to me.","4","My opinions and ideas are valued by my colleagues, superiors and management.","3","My individual goals are aligned with my departmental and company goals.","3","My increments and incentives are fairly linked to performance.","3","I feel appreciated, recognized and rewarded for my work contributions.","3","I am satisfied with the level of communication from leadership.","2","I would rate employee referral policy at KISNA. ","2","I would rate KISNA’s work culture and work environment.","2","I am satisfied with my work-life balance.","2","I would rate my job security at KISNA.","2","I would rate my overall experience at KISNA.","2",,,,,,,,,,,,,,,,,,,,,,,,,,,,,,,,,,,,
"Dikshant Buwa","What would be your response for KISNA on the following: (Yes/No)","Finance","0-6 months","6/27/2025","10:02:27 AM","I receive all the necessary information and resources to start my job effectively (for e.g. Laptop, seating arrangement, email ID, visiting card, ID card).","Yes","My job responsibilities are aligned with what was communicated to me during the Interview / Hiring process.","Yes"," My work schedule is disturbed by the unplanned meeting.","No","My reporting manager provides regular coaching, guidance and feedback.","No","I am encouraged to learn from my mistakes without being penalized for failure.","Yes"," I have the freedom to give suggestions for improving systems or processes in my function or the company.","Yes","HR policies are communicated accurately and on time.","Yes","I feel that men and women have equal opportunities at KISNA.","Yes"," I have witnessed or experienced Team Politics, Manager Politics, Favoritism or unfair treatment in the workplace.","Yes","I would recommend job opportunities at KISNA to others.","Yes",,,,,,,,,,,,,,,,,,,,,,,,,,,,,,,,,,,,,,,,,,,,,,
"Dikshant Buwa","Daily Activities","Finance","0-6 months","6/27/2025","10:02:27 AM","Aan Paan (Vipasana Meditation)","Continue","Clap Theory","Continue","Corporate Prayer at 10:10 AM","Continue","National Anthem","Discontinue","Shanti Havan in Surat","Discontinue","Meditation Sessions","Discontinue","English / Chinese / German / Italian / Japanese Language Classes","Continue","Lunch Provision to the Underprivileged on Customer's Birthdays","Continue","Motivational Video","Continue","Yoga Sessions","NA",,,,,,,,,,,,,,,,,,,,,,,,,,,,,,,,,,,,,,,,,,,,,,
"Dikshant Buwa","Weekly Activities","Finance","0-6 months","6/27/2025","10:02:27 AM","Book Reading","Continue","Group Meditation Session","Continue","Kaizen System","Continue","Saturday Motivational Videos","Continue","Tiffin Days on Saturdays","Continue","Weekly Dress Code ","Continue","Challenge and Celebrations","Continue","Innovative Idea Friday","Continue","Learning and Development Programs","Discontinue",,,,,,,,,,,,,,,,,,,,,,,,,,,,,,,,,,,,,,,,,,,,,,,,
"Dikshant Buwa","Monthly Activities","Finance","0-6 months","6/27/2025","10:02:27 AM","Birthday Celebration","Continue","Blazer Day on 13th Of Every Month","Continue","Fun and Learn Saturdays","Continue","Ekadashi Fast","Discontinue","Monthly Meetings ","Discontinue","Swachh Bharat Abhiyan","Discontinue",,,,,,,,,,,,,,,,,,,,,,,,,,,,,,,,,,,,,,,,,,,,,,,,,,,,,,
"Dikshant Buwa","Bi - Annual Activities","Finance","0-6 months","6/27/2025","10:02:27 AM","Guest Faculty Interactive Sessions","Continue","Launching of HK Connect Newsletter","Discontinue","Assistance in Natural Disaster Relief","NA",,,,,,,,,,,,,,,,,,,,,,,,,,,,,,,,,,,,,,,,,,,,,,,,,,,,,,,,,,,,
"Dikshant Buwa","Annually","Finance","0-6 months","6/27/2025","10:02:27 AM","Annual Program","Continue","Annual Staff Picnics","Continue","Annual Target Meeting ","Continue","Blood Donation Camps 3 times a year","Continue","Childrens Day","Continue","Christmas Celebration ","Continue","Diwali Exhibition by Special Kids","Continue","Diwali Garment Exhibition","Continue","Diwali Gifts Distribution","Continue","Diwali Meet and Greet Program","Continue","English Improvement Test","Continue","Eye Check Up Camp","Continue","Father's Day","Continue","Fire Evacuation Drill","Continue","Friendship Day","Continue","Haldi Kumkum Celebration","Continue","Haridwar Pilgrimage","Continue","Customer Gift - Commitment Diary and Personalized Photo Calendar","Continue","Healthcare & Family Support Reward","Continue","Health Checkup Camps and Consultation Camps","Continue","International Yoga Day","Continue","Kisna Diamond Marathon","Continue","Krishna Janmashtami Celebration","Continue","Mother's Day ","Continue","Navratri Garba Raas","Continue","Notebooks Distribution","Continue","Online Motivational Program","Continue","Pillars of Hari Krishna","Continue","Sankalp Lagna Utsav","Continue","Sports Day","Continue","Helping with Children's Education","Continue","Women's Day","Continue","World Book Day","Continue"
"Dikshant Buwa","Survey","Finance","0-6 months","6/27/2025","10:02:27 AM","Which of our current policies, practices, or activities; do you think should be continued?","fg f","Which of our current policies, practices, or activities; do you think should be discontinued?","rg nsrg","What new policies, practices, or activities; do you think should be initiated?","g bardgtn",,,,,,,,,,,,,,,,,,,,,,,,,,,,,,,,,,,,,,,,,,,,,,,,,,,,,,,,,,,,